{
  "schemaVersion": 1,
  "root": "D:\\\\repo",
  "branch": "main",
  "detached": false,
  "clean": false,
  "truncated": false,
  "entries": [
    {
      "path": "src/main.rs",
      "indexStatus": "M",
      "worktreeStatus": " ",
      "staged": true,
      "unstaged": false,
      "untracked": false
    }
  ]
}
